**ISP**,**Locations**,**Public IPv6**,**Crypto Payments**,**Comments**,**Last Updated**
[Flokinet](https://flokinet.is),"Netherlands, Iceland, Romania,France","Yes, needs a ticket and custom setup","yes, including XMR","Very slow customer support. SMTP outbound (25/465/587) open by default - all FlokiNET-hosted exits pass real Gmail/Fastmail/Yandex/Outlook banner test.",04/2026
[BitLaunch](https://bitlaunch.io),"Canada, USA, UK",No,Yes,Expensive. Digial Ocean through BitLanch has IPv6,05/2024
[Hostinger](https://hostinger.com),"France, Lithuania, India, USA, Brazil","Yes, out of the box",Yes,"Not fast enough, Crypto payments must be done per each server monthly or annually. SMTP outbound (25/465/587) open by default on all tested Hostinger-hosted exits.",04/2026
[Linode](https://linode.com),"USA, Canada, Japan, India, Indonesia, Sweden, Netherlands, Germany, Brazil, France, UK, Australia, Italy",Yes out of the box,"No, only through [BitLAunch](https://bitlaunch.io)","IPv6 sometimes need to be re-added in Networking tab, no reboot needed. SMTP outbound (port 25) blocked for new accounts; ports 465/587 mostly open. Unblock requires account verification.",04/2026
[Cherry Servers](https://www.cherryservers.com),"Lithuania, Netherlands, USA, Singapore",No,Yes,Issued IP doesn’t match the location offered by the provider.,05/2024
[Njalla](https://nja.la),Sweden,Yes,Yes,"Privacy vandguards! The biggest VPS 45 is 3 cores only, but it works better than many “larger” servers on the market.",05/2024
[HostSailor](https://hostsailor.com),USA,"Yes, based on ticket",Yes,The IPv6 setup needs custom research and is not documented,05/2024
[Misaka](https://www.misaka.io/),South Africa,"Yes, native support",No,Very Expensive,05/2024
[IsHosting](https://ishosting.com/en),"Brazil, Netherlands","Yes, based on ticket",Yes,Expensive,05/2024
[AlexHost](https://alexhost.com),"Moldova, Bulgaria, Sweden, Netherlands","Yes, on by default",Yes,"They allow TOR Bridges, Relays. Exit nodes are only allowed on dedicated servers (prices start from 26 EUR)",07/2024
[iHostArt](https://ihostart.com),Romania,"Yes, on by default",Yes,"Super permissive provider. They do allow Tor Exit/Relay/Bridge. Pro-free speech etc. Recently, IPv6 geolocation was set to North Korea, so be aware.",07/2024
[Incognet](https://incognet.io),Netherlands and USA,"Yes, on by default",Yes,They allow Tor exit nodes but you must adhere to their rules https://incognet.io/tor-exits,07/2024
[vSys Host](https://vsys.host),"Ukraine, Netherlands, USA","Yes, on by default",Yes,"Pretty permissive provider registered in Ukraine. Should allow Relay/Exit nodes but nothing in T&C, so better double check.",07/2024
[LiteServer](https://liteserver.nl),Netherlands,"Yes, on by default",Yes,Very reliable Dutch provider. They do allow Relay nodes but for Exit nodes you need to contact them. Always check T&C https://liteserver.nl/legal,07/2024
[TerraHost](https://terrahost.no),Norway,"Yes, on by default",Yes,Very reliable Norwegian provider. Only allow exit nodes on Dedicated servers subject to certain caveats (you must open a ticket). Always check T&C https://terrahost.no/avtalebetingelser,07/2024
[Mevspace](https://mevspace.com),Poland,"Yes, on by default",Yes,"Flexible Polish providers with 3 DCs in Poland. They do allow Tor Exit nodes but you may need a dedicated server for this. Make sure you open a ticket to check. As of today's date, they have 48h for 1 EUR tariff",07/2024
[Hostiko](https://hostiko.com.ua),"Ukraine, Germany","Yes, on by default",Yes,"Ukrainian provider. They allow Exit nodes on Germany boxes but limit the bandwidth, you also have to restrict certain ports like 25 and 587. Make sure you open a ticket.",07/2024
[Hostslick](https://hostslick.com),"Netherlands, Germany","Yes, on by default",Yes,Good amount of bandwidth for the price. Make sure you open the ticket if you want to run Exit node,07/2024
[RDP](https://rdp.sh),"Netherlands, USA, Poland","Yes, on by default",Yes,"German provider. Exit nodes are allowed, policy is here https://rdp.sh/docs/faq/tor ports 25,465,587 must be closed. Make sure you open a ticket before running an exit node.",07/2024
[Lowendbox](https://lowendbox.com/category/dedicated-servers), , , ,Just an aggregator with good offers,07/2025
[Thundervm](https://thundervm.com/en/hosting/dedicated-server),"USA, UK, France, Italy, Switzerland, Netherlands",,Yes, ,07/2025
[OVH](https://us.ovhcloud.com/bare-metal/rise/rise-3/),"USA, DE, FR, UK, PL, CA", ,No,"Exit nodes not allowed on VPS offering, see their [Service Specific Terms](https://us.ovhcloud.com/legal/service-specific-terms/). Not all locations always available. SMTP outbound (25/465/587) generally open with rate limits; some operator-specific iptables filters observed on individual nodes.",04/2026
[Mebilcom](https://www.melbicom.net/dedicatedserver/),"NL, US, DE, UAE, NG, ESP, IN, IT, FR, LT, SG, BG, LV, PL",,No,"SMTP outbound (25/465/587) filtered at the network edge across all observed Melbikom-hosted Nym exits. Unblock unlikely without case-by-case justification.",04/2026
[Servermania](https://www.servermania.com/dedicated-servers-hosting.htm),"USA, Canada",,No,,07/2025
[Oneprovider](https://oneprovider.com/en/dedicated-servers/ipv6),"PL, FR, NL, UA, USA, BG, RO, DK, ESP, NO, CZ, RS, IE, IT, UK, HU, CH, SK, AT, BE, BA, HK, JP, SG, LU, AU, SWE, UAE, BR, CR, MX, GR, CL, MA, AR",Yes,No,"SMTP outbound (25/465/587) filtered by default in many DCs (confirmed: Stockholm, Taipei, Zurich; some US DCs incl. Ashburn). Unblock can be requested via ticket and is usually granted within hours, conditional on no abuse. Guatemala DC observed open by default.",04/2026
[Ionos](https://www.ionos.com/servers/amd-servers),"USA, DE, UK, ESP, FR",,No,"SMTP outbound (25) blocked by default; 465/587 typically allowed.",04/2026
[Leaseweb](https://www.leaseweb.com/en/configure/vc/product/entityKey/DEDSER02_NEW_ORDER_BUSINESS_R740XD-24SFF-6134),"USA, NL, DE, UK, CA, SG, JP, AUS, HK",,No,"KYC mandatory. SMTP outbound varies by DC; APAC DCs observed filtered, others open.",04/2026
[M247](https://m247.com/eu/services/host/dedicated-servers/),"UK, Austria, Br, Sw, Jp, Poland, Fr, USA, Netherlands",Yes,No,"SMTP outbound (25/465/587) open by default on all observed M247-hosted exits.",04/2026
[Hostroyale](https://hostroyale.com/hosting/dedicated-server/),Various countries with different pricing,, Yes,,07/2025
[DataPacket](https://www.datapacket.com/pricing),"NL, GR, SK, BE, RO, HU, DK, IE, DE, UA, PT, GB, ES, FR, IT, NO, CZ, BG, SE, AT, PL, HR, CH, USA, CO, AR, PE, MX, CL, TR, ZA, NG, IL, HK, AU, SG, JP",Yes,,,07/2025
[Zenlayer](https://www.zenlayer.com/bare-metal/), [advertised over 50 locations](50+ https://www.zenlayer.com/global-network),,,,07/2025
[PrivateLayer](https://privatelayer.com),Swiss,Yes,Yes,Slow customer response,07/2025
[AmeriNoc](https://www.amerinoc.com),USA,Yes,,,07/2025
[Colocall](https://www.colocall.net/),Ukraine,Yes,,,07/2025
[Incognet](https://incognet.io/kansas-city-dedicated-servers),"USA, Netherlands",Yes,,,07/2025
[FranTech](https://my.frantech.ca),USA,Yes,,,07/2025
[Psychz](https://www.psychz.net),"USA, UK, Brazil, Japan, Russia, South Africa and many more",Yes,,,07/2025
[Fsit](https://www.fsit.com/server/vps-vserver-kvm),Swiss,Yes,Yes,,07/2025
[NiceVPS](https://nicevps.net/),Netherlands,Yes,,,07/2025
[Dataclub](https://www.dataclub.eu/),"Latvia, Sweden, Netherlands",Yes,,,07/2027
[Privex](https://www.privex.io/tor-exit-policy/),"USA, Germany, Sweden",Yes,Yes,,07/2025
[Svea](https://svea.net/vps),Sweden,Yes,,,07/2025
[Hostraha](https://hostraha.com),Kenya and other African countries,"No, but advertised otherwise","Yes, USDT TRC20","Don't recommend. Unresponsive technical and billing support, never provided IPv6 even though advertised and paid for. When VPS cancelled, company still tried to bill the credit card on file multiple times.",08/2025
[HostHatch](https://hosthatch.com),"USA, NL, DE, IN, AE, SG, JP, AU, SE",Yes,Yes,"SMTP outbound (25/465/587) open by default on all observed HostHatch-hosted Nym exits.",04/2026
[netcup](https://www.netcup.com),"DE, AT, NL, US","Yes, on by default","No","SMTP outbound varies. EU DCs (DE, AT, NL) generally open with rate limits. US DCs observed filtered (Aether-gw-us cluster). Open ticket to confirm/request unblock.",04/2026
[Contabo](https://contabo.com),"DE, US, UK, SG, JP, IN, AU","Yes, on by default","No","SMTP outbound (25) blocked by default to prevent abuse. Ports 465/587 typically open. Request unblock with use case description.",04/2026
[Hetzner](https://www.hetzner.com),"DE, FI, US","Yes, on by default","No","SMTP outbound (25) blocked by default. 465/587 generally open. Unblock for port 25 requires identity verification and stated business use case; granted case-by-case.",04/2026
[WorkTitans](https://worktitans.com),"GE, RU, AE, CY, BG, GB, MD, multiple resold ranges","Yes, on by default","Yes","SMTP outbound (25/465/587) open by default on virtually all observed WorkTitans-hosted Nym exits (113/113 tested with only minor IP-reputation issues at a few endpoints). Privacy-friendly reseller.",04/2026
[xneelo](https://xneelo.co.za),"South Africa","Yes, on by default","No","SMTP outbound (25/465/587) open by default. Reliable South African provider.",04/2026
[DigitalOcean](https://www.digitalocean.com),"USA, Canada, NL, DE, UK, IN, SG, AU","Yes, on by default","No","SMTP outbound (25) blocked by default for all new accounts as anti-abuse policy. Unblock requires account verification and submitting a use case to support; not always granted. Ports 465/587 sometimes also affected.",04/2026
